{
  "schema": {
    "id": "serbian-golden-corpus",
    "version": 1
  },
  "seed": 20260826,
  "torch_num_threads": 1,
  "sample_rate": 24000,
  "model_sha256_expected": "4e6d11053886acd15f4e2b873efef87b7d53885bcf80b3b5fe73f79dd253ca47",
  "voice_sha256_expected": "0c16ae704368f69e5e1467a702594f56f11a5cfdd38e9ae43b708932c1d6fb8a",
  "max_input_symbols": 507,
  "corpus": {
    "corpus_id": "serbian-golden-vectors",
    "version": "reference-20260827-task-3.4",
    "input_provenance": {
      "kind": "self-authored",
      "license_status": "project-owned",
      "statement": "All utterances were written for this project; they are not excerpts from a third-party publication or dataset."
    },
    "coverage": {
      "latin-cyrillic-equivalence": [
        "greeting-latin",
        "greeting-cyrillic",
        "digraphs-latin",
        "digraphs-cyrillic"
      ],
      "diacritics": [
        "diacritics-latin",
        "diacritics-cyrillic",
        "digraphs-latin",
        "digraphs-cyrillic"
      ],
      "digraphs": [
        "digraphs-latin",
        "digraphs-cyrillic"
      ],
      "mixed-scripts": [
        "mixed-scripts"
      ],
      "foreign-names": [
        "foreign-names"
      ],
      "abbreviations": [
        "abbreviations"
      ],
      "numbers": [
        "mixed-digits",
        "numbers-expanded"
      ],
      "dates": [
        "dates"
      ],
      "currencies": [
        "currencies"
      ],
      "measurements": [
        "measurements"
      ],
      "roman-numerals": [
        "roman-numerals"
      ],
      "punctuation": [
        "punctuation",
        "cyrillic-punctuation",
        "punctuation-extended"
      ],
      "urls": [
        "urls"
      ],
      "email": [
        "email"
      ],
      "citations": [
        "citations"
      ],
      "page-artifacts": [
        "page-artifacts"
      ]
    },
    "equivalence_groups": {
      "greeting-equivalence": {
        "vector_ids": [
          "greeting-latin",
          "greeting-cyrillic"
        ],
        "expected": "same_ipa_and_token_ids"
      },
      "digraphs-equivalence": {
        "vector_ids": [
          "digraphs-latin",
          "digraphs-cyrillic"
        ],
        "expected": "same_ipa_and_token_ids"
      }
    },
    "vector_contract": {
      "schema_id": "serbian-golden-vector",
      "schema_version": 1,
      "stage_order": [
        "cleanup_text",
        "normalized_text",
        "phonemes",
        "token_ids",
        "protected_spans",
        "chunk_boundaries",
        "reference_audio"
      ],
      "stage_semantics": {
        "cleanup_text": "Text after the reference cleanup stage. The pinned desktop capture has no text cleanup stage, so this is an exact copy of text.",
        "normalized_text": "Text passed to phonemize_serbian. The pinned desktop capture has no text normalization stage, so this is an exact copy of cleanup_text.",
        "phonemes": "The normalized IPA code-point sequence returned by the pinned phonemize_serbian function.",
        "token_ids": "Kokoro vocabulary IDs for each phoneme code point, with token 0 prepended and appended.",
        "protected_spans": "Sorted half-open Unicode code-point ranges into normalized_text that a future chunker must not split. The pinned capture has no protected-span stage, so this is empty.",
        "chunk_boundaries": "Sorted half-open Unicode code-point ranges into phonemes. Each current vector is one unsplit model call because it is within the operational input limit; task 3.5 owns limit-edge cases.",
        "reference_audio": "Metadata for the seeded mono 24 kHz PCM-16 WAV produced by the pinned desktop PyTorch call, including its relative path and SHA-256."
      }
    },
    "generation": {
      "script": "model-tools/scripts/capture_reference_vectors.py",
      "command": "model-tools/.venv/bin/python model-tools/scripts/capture_reference_vectors.py",
      "reference_runtime": {
        "kokoro_repository": "https://github.com/semidark/kokoro.git",
        "kokoro_revision": "b96fef95e6a746495f92443fac7c688f90fc57fc",
        "kokoro_sr_repository": "https://github.com/homoludens/kokoro-serbian.git",
        "kokoro_sr_revision": "ca5590d9576f63b0763e51a73de0596d47f05425",
        "espeak_ng_command": "espeak-ng -q --ipa=3 -v sr --stdin",
        "espeak_ng_version": "1.52.0",
        "model_sha256": "4e6d11053886acd15f4e2b873efef87b7d53885bcf80b3b5fe73f79dd253ca47",
        "voice_sha256": "0c16ae704368f69e5e1467a702594f56f11a5cfdd38e9ae43b708932c1d6fb8a"
      },
      "seed": 20260826,
      "torch_num_threads": 1,
      "speed": 1.0,
      "input_manifest_sha256": "f5d8e06f1b77b8078ef3e88e60e0447fbfb3ecd693f85d93a01fbe98c6a2912e",
      "non_deterministic_measurements": [
        "infer_seconds"
      ]
    }
  },
  "vectors": [
    {
      "id": "greeting-latin",
      "script": "latin",
      "text": "Dobar dan, ovo je glas Dragane. Ona čita knjige svakog jutra.",
      "categories": [
        "latin-cyrillic-equivalence"
      ],
      "equivalence_group": "greeting-equivalence",
      "cleanup_text": "Dobar dan, ovo je glas Dragane. Ona čita knjige svakog jutra.",
      "normalized_text": "Dobar dan, ovo je glas Dragane. Ona čita knjige svakog jutra.",
      "phonemes": "dˈobɑr dˈan ˈovo je ɡlˈaz drˈaɡɐnɛ ˈonɐ ʧˈitɐ kɲˈiɡɛ svˈakoɡ jˈutrɐ",
      "phoneme_count": 67,
      "ipa": "dˈobɑr dˈan ˈovo je ɡlˈaz drˈaɡɐnɛ ˈonɐ ʧˈitɐ kɲˈiɡɛ svˈakoɡ jˈutrɐ",
      "ipa_len": 67,
      "voice_row_index": 67,
      "token_ids": [
        0,
        46,
        156,
        57,
        44,
        69,
        60,
        16,
        46,
        156,
        43,
        56,
        16,
        156,
        57,
        64,
        57,
        16,
        52,
        47,
        16,
        92,
        54,
        156,
        43,
        68,
        16,
        46,
        60,
        156,
        43,
        92,
        70,
        56,
        86,
        16,
        156,
        57,
        56,
        70,
        16,
        133,
        156,
        51,
        62,
        70,
        16,
        53,
        114,
        156,
        51,
        92,
        86,
        16,
        61,
        64,
        156,
        43,
        53,
        57,
        92,
        16,
        52,
        156,
        63,
        62,
        60,
        70,
        0
      ],
      "token_count": 69,
      "audio_samples": 124200,
      "duration_s": 5.175,
      "peak": 0.35661494731903076,
      "rms": 0.066235,
      "finite": true,
      "wav": "/home/homoludens/projekti/citac_knjiga/model-tools/reference/greeting-latin.wav",
      "protected_spans": [],
      "chunk_boundaries": [
        {
          "start": 0,
          "end": 67
        }
      ],
      "reference_audio": {
        "path": "model-tools/reference/greeting-latin.wav",
        "sha256": "dd89e0736a68e371131799de0047c65096a45d8393b8745e8b302a403d45f173",
        "format": "wav",
        "subtype": "PCM_16",
        "sample_rate_hz": 24000,
        "channels": 1,
        "sample_count": 124200,
        "duration_s": 5.175,
        "peak": 0.35661494731903076,
        "rms": 0.066235,
        "finite": true
      },
      "infer_seconds": 8.68
    },
    {
      "id": "greeting-cyrillic",
      "script": "cyrillic",
      "text": "Добар дан, ово је глас Драгане. Она чита књиге сваког јутра.",
      "categories": [
        "latin-cyrillic-equivalence"
      ],
      "equivalence_group": "greeting-equivalence",
      "cleanup_text": "Добар дан, ово је глас Драгане. Она чита књиге сваког јутра.",
      "normalized_text": "Добар дан, ово је глас Драгане. Она чита књиге сваког јутра.",
      "phonemes": "dˈobɑr dˈan ˈovo je ɡlˈaz drˈaɡɐnɛ ˈonɐ ʧˈitɐ kɲˈiɡɛ svˈakoɡ jˈutrɐ",
      "phoneme_count": 67,
      "ipa": "dˈobɑr dˈan ˈovo je ɡlˈaz drˈaɡɐnɛ ˈonɐ ʧˈitɐ kɲˈiɡɛ svˈakoɡ jˈutrɐ",
      "ipa_len": 67,
      "voice_row_index": 67,
      "token_ids": [
        0,
        46,
        156,
        57,
        44,
        69,
        60,
        16,
        46,
        156,
        43,
        56,
        16,
        156,
        57,
        64,
        57,
        16,
        52,
        47,
        16,
        92,
        54,
        156,
        43,
        68,
        16,
        46,
        60,
        156,
        43,
        92,
        70,
        56,
        86,
        16,
        156,
        57,
        56,
        70,
        16,
        133,
        156,
        51,
        62,
        70,
        16,
        53,
        114,
        156,
        51,
        92,
        86,
        16,
        61,
        64,
        156,
        43,
        53,
        57,
        92,
        16,
        52,
        156,
        63,
        62,
        60,
        70,
        0
      ],
      "token_count": 69,
      "audio_samples": 124200,
      "duration_s": 5.175,
      "peak": 0.35661494731903076,
      "rms": 0.066235,
      "finite": true,
      "wav": "/home/homoludens/projekti/citac_knjiga/model-tools/reference/greeting-cyrillic.wav",
      "protected_spans": [],
      "chunk_boundaries": [
        {
          "start": 0,
          "end": 67
        }
      ],
      "reference_audio": {
        "path": "model-tools/reference/greeting-cyrillic.wav",
        "sha256": "dd89e0736a68e371131799de0047c65096a45d8393b8745e8b302a403d45f173",
        "format": "wav",
        "subtype": "PCM_16",
        "sample_rate_hz": 24000,
        "channels": 1,
        "sample_count": 124200,
        "duration_s": 5.175,
        "peak": 0.35661494731903076,
        "rms": 0.066235,
        "finite": true
      },
      "infer_seconds": 8.4
    },
    {
      "id": "diacritics-latin",
      "script": "latin",
      "text": "Šešir, čuvar, žvakać guma, džep, ćirilično pismo i đavo.",
      "categories": [
        "diacritics"
      ],
      "cleanup_text": "Šešir, čuvar, žvakać guma, džep, ćirilično pismo i đavo.",